{
  "schema": "contrepoint/registre-partis/1",
  "version": "0.3.0",
  "date_registre": "2026-08-27",
  "licence": "Licence Ouverte / Open Licence (Etalab)",
  "legislatures": [
    {
      "numero": "17",
      "chambre": "AN",
      "debut": "2024-07-18",
      "fin": null,
      "source": "declaration_publique",
      "url": "https://www.assemblee-nationale.fr/dyn/17/comptes-rendus/seance/session-de-droit-de-2024/seance-du-jeudi-18-juillet-2024",
      "etabli_le": "2026-08-27",
      "remarque": "Ouverture de la législature : première séance du 2024-07-18, article 12 de la Constitution."
    }
  ],
  "sources": [
    {
      "id": "an_organe",
      "libelle": "Assemblée nationale — référentiel AMO30, objets organe (codeType GP et PARPOL)",
      "url": "https://data.assemblee-nationale.fr/static/openData/repository/17/amo/tous_acteurs_mandats_organes_xi_legislature/AMO30_tous_acteurs_tous_mandats_tous_organes_historique.json.zip",
      "recupere_le": "2026-08-27",
      "empreinte_sha256": "bbecd01274d2bc9f46fcaa276b06868862ae7680131da3162e35b5cbef663061",
      "cardinalite": "un_par_date",
      "licence": "Licence Ouverte / Open Licence (Etalab)",
      "remarque": "organePrecedentRef est nul sur les 63 GP et les 58 PARPOL : la source ne déclare aucune succession."
    },
    {
      "id": "an_parpol_mandats",
      "libelle": "Assemblée nationale — mandats de typeOrgane PARPOL des acteurs (AMO30)",
      "url": "https://data.assemblee-nationale.fr/static/openData/repository/17/amo/tous_acteurs_mandats_organes_xi_legislature/AMO30_tous_acteurs_tous_mandats_tous_organes_historique.json.zip",
      "recupere_le": "2026-08-27",
      "empreinte_sha256": "bbecd01274d2bc9f46fcaa276b06868862ae7680131da3162e35b5cbef663061",
      "cardinalite": "plusieurs",
      "licence": "Licence Ouverte / Open Licence (Etalab)",
      "remarque": "Rattachement déclaratif annuel, non adhésion : 111 députés EPR et DEM déclarent ESBMP, aucun Renaissance."
    },
    {
      "id": "ches_2024",
      "libelle": "Chapel Hill Expert Survey 2024 — colonne party_id, country = 6",
      "url": "https://github.com/chesdata/chesdata.github.io/releases/download/ches-europe/CHES_2024_final_v2.csv",
      "recupere_le": "2026-08-27",
      "empreinte_sha256": "1c1ec0532afa2a0a13317122cbbe40eb9ff35425191892d1fff24fbef6acc6a8",
      "cardinalite": "un_par_date",
      "licence": "non redistribué — téléchargé par script",
      "remarque": "10 partis français dans la vague 2024. Fichier jamais commité (ADR 0000 §4)."
    },
    {
      "id": "ches_trend",
      "libelle": "CHES trend file 1999-2024 — colonnes party_id et cmp_id, country = 6",
      "url": "https://github.com/chesdata/chesdata.github.io/releases/download/ches-trend/1999-2024_CHES_dataset_meansV2.csv",
      "recupere_le": "2026-08-27",
      "empreinte_sha256": "254384ab9f542bbaa62ec7e0dc36f2d0cc0471629c2c9587d0ecaed34914a033",
      "cardinalite": "un_par_date",
      "licence": "non redistribué — téléchargé par script",
      "remarque": "party_id est stable à travers les changements de nom : 610 = FN puis RN, 609 = RPR/UMP/LR."
    },
    {
      "id": "declaration_publique",
      "libelle": "Déclaration publique citée ligne par ligne (champ url obligatoire)",
      "url": null,
      "recupere_le": "2026-08-27",
      "empreinte_sha256": null,
      "cardinalite": "plusieurs",
      "licence": "s.o.",
      "remarque": "Seule source admise pour ce qu'aucun jeu de données ne publie. Exige une relecture humaine."
    },
    {
      "id": "manifesto",
      "libelle": "Manifesto Project (MARPOR) — code parti CMP",
      "url": "https://manifesto-project.wzb.eu/",
      "recupere_le": "2026-08-27",
      "empreinte_sha256": null,
      "cardinalite": "un_par_date",
      "licence": "conditions non vérifiées — clé d'API requise",
      "remarque": "Valeurs reprises de la colonne cmp_id de ches_trend, non confrontées a la source : A VERIFIER."
    },
    {
      "id": "nuance_leg2024",
      "libelle": "Ministere de l'Interieur — codes de nuance constatés dans les resultats definitifs des legislatives 2024",
      "url": "https://static.data.gouv.fr/resources/elections-legislatives-des-30-juin-et-7-juillet-2024-resultats-definitifs-du-2nd-tour/20240710-170536/resultats-definitifs-par-region.csv",
      "recupere_le": "2026-08-27",
      "empreinte_sha256": "f8552401cffade4397fa501f161c961d377d629235d9f9a813ecb11ad5ba0c50",
      "cardinalite": "plusieurs",
      "licence": "Licence Ouverte v2.0 (champ license = lov2 sur data.gouv.fr)",
      "remarque": "17 codes au 2nd tour, 22 au 1er. Grille : annexe de l'instruction IOMA2415630C du 2024-06-11."
    },
    {
      "id": "parlgov",
      "libelle": "ParlGov development — party.csv, country_id 43 (France)",
      "url": "https://parlgov.org/data/parlgov-development_csv-utf-8/party.csv",
      "recupere_le": "2026-08-27",
      "empreinte_sha256": "b8c6006c0a30e8830e13f1a9834e138722fe0de0761ddc44cf9b1667bbcad8ba",
      "cardinalite": "un_par_date",
      "licence": "conditions non vérifiées",
      "remarque": "80 partis français. name_short fusionne les dénominations successives : 'UMP|LR', 'REM|R', 'FN'."
    },
    {
      "id": "wikidata",
      "libelle": "Wikidata — QID d'entite, P31/P279* = Q7278, P17 = Q142",
      "url": "https://query.wikidata.org/sparql",
      "recupere_le": "2026-08-27",
      "empreinte_sha256": null,
      "cardinalite": "un_par_date",
      "licence": "CC0",
      "remarque": "Pivot d'identité seulement. P571 est multivalué (UDR : 2012-07-17 et 2024-08-31) : jamais source de date."
    }
  ],
  "entites": [
    {
      "id": "coalition.ensemble",
      "nature": "coalition",
      "nom": "Ensemble",
      "sigle": "ENS",
      "debut": null,
      "fin": null,
      "identifiants": [
        {
          "source": "wikidata",
          "valeur": null,
          "libelle_source": null,
          "debut": null,
          "fin": null,
          "etabli_le": "2026-08-27",
          "motif": "Aucune entite univoque : la recherche renvoie une page d'homonymie (Q112895317).",
          "remarque": null
        },
        {
          "source": "nuance_leg2024",
          "valeur": "ENS",
          "libelle_source": null,
          "debut": null,
          "fin": null,
          "etabli_le": "2026-08-27",
          "motif": null,
          "remarque": "Code de coalition : il ne distingue pas RE, MoDem et Horizons."
        },
        {
          "source": "an_organe",
          "valeur": null,
          "libelle_source": null,
          "debut": null,
          "fin": null,
          "etabli_le": "2026-08-27",
          "motif": "Le référentiel ne modélise pas les coalitions electorales.",
          "remarque": null
        }
      ],
      "composition": [],
      "remarque": "Conservée pour porter le code ENS. Aucun pivot d'identité disponible."
    },
    {
      "id": "coalition.nfp",
      "nature": "coalition",
      "nom": "Nouveau Front populaire",
      "sigle": "NFP",
      "debut": "2024-06-10",
      "fin": null,
      "identifiants": [
        {
          "source": "wikidata",
          "valeur": "Q126487286",
          "libelle_source": "Nouveau Front populaire",
          "debut": null,
          "fin": null,
          "etabli_le": "2026-08-27",
          "motif": null,
          "remarque": "P31 = coalition politique. P571 unique."
        },
        {
          "source": "nuance_leg2024",
          "valeur": "UG",
          "libelle_source": null,
          "debut": null,
          "fin": null,
          "etabli_le": "2026-08-27",
          "motif": null,
          "remarque": "Code de coalition : il ne distingue pas LFI, PS, ECO et COM."
        },
        {
          "source": "an_organe",
          "valeur": null,
          "libelle_source": null,
          "debut": null,
          "fin": null,
          "etabli_le": "2026-08-27",
          "motif": "Le référentiel ne modélise pas les coalitions electorales.",
          "remarque": null
        }
      ],
      "composition": [
        {
          "entite": "parti.lfi",
          "debut": "2024-06-10",
          "fin": null,
          "source": "declaration_publique",
          "url": "https://www.assemblee-nationale.fr/dyn/17/organes/groupes-politiques",
          "etabli_le": "2026-08-27",
          "remarque": null
        },
        {
          "entite": "parti.ps",
          "debut": "2024-06-10",
          "fin": null,
          "source": "declaration_publique",
          "url": "https://www.assemblee-nationale.fr/dyn/17/organes/groupes-politiques",
          "etabli_le": "2026-08-27",
          "remarque": null
        },
        {
          "entite": "parti.ecologistes",
          "debut": "2024-06-10",
          "fin": null,
          "source": "declaration_publique",
          "url": "https://www.assemblee-nationale.fr/dyn/17/organes/groupes-politiques",
          "etabli_le": "2026-08-27",
          "remarque": null
        },
        {
          "entite": "parti.pcf",
          "debut": "2024-06-10",
          "fin": null,
          "source": "declaration_publique",
          "url": "https://www.assemblee-nationale.fr/dyn/17/organes/groupes-politiques",
          "etabli_le": "2026-08-27",
          "remarque": null
        },
        {
          "entite": "parti.place-publique",
          "debut": "2024-06-10",
          "fin": null,
          "source": "declaration_publique",
          "url": "https://www.assemblee-nationale.fr/dyn/17/organes/groupes-politiques",
          "etabli_le": "2026-08-27",
          "remarque": null
        }
      ],
      "remarque": "Composition à relire ligne par ligne : aucune source de données ne la publie."
    },
    {
      "id": "parti.ecologistes",
      "nature": "parti",
      "nom": "Les Écologistes – Europe Écologie Les Verts",
      "sigle": "Les Écologistes",
      "debut": "2010-11-13",
      "fin": null,
      "identifiants": [
        {
          "source": "an_organe",